id	timestamp	hypothesis	change_summary	issue_number	pr_number	score_before	score_after	delta	verdict	cost_usd	notes	research_citations
1	2026-07-01T16:23:43.767383	Scaffold retro games portal with Next.js 16, Tailwind v4 retro theme, and game card grid			2				revert	5.3410085	[OVERRIDDEN by finalize gate] precheck failed: score_direction. ceo:keep greenfield_scaffold=true qa_clean=true build_pass=true lint_pass=true pr_number=2 growth_dimension=capability_surface features=homepage,game_cards,category_nav,featured_section,retro_theme	
1	2026-07-01T16:23:54.897456	Scaffold retro games portal with Next.js 16, Tailwind v4 retro theme, and game card grid			2				keep	5.3410085	ceo:keep greenfield_scaffold=true qa_clean=true build_pass=true lint_pass=true pr_number=2 growth_dimension=capability_surface features=homepage,game_cards,category_nav,featured_section,retro_theme force_reason=greenfield_no_eval_configured	
2	2026-07-01T17:22:16.719725				4				revert	12.603040000000002	[OVERRIDDEN by finalize gate] precheck failed: score_direction. ceo:keep capability_surface_jump=5_playable_games auth_stripped=clean lint=0_errors build=pass routes=9/9 qa_iterations=2	
2	2026-07-01T17:22:23.164759				4				keep	12.603040000000002	ceo:keep capability_surface_jump=5_playable_games auth_stripped=clean lint=0_errors build=pass routes=9/9 qa_iterations=2 override=no_eval_configured	
